{
  "id": "asset-review-demo",
  "assetId": "hair-short-01",
  "teamId": "team-demo",
  "status": "approved",
  "licenseStatus": "verified",
  "reviewerId": "user-demo",
  "decision": "approve",
  "notes": "Placeholder asset approved for MVP commercial demos.",
  "createdAt": "2026-07-09T00:00:00.000Z",
  "submittedAt": "2026-07-09T00:10:00.000Z",
  "reviewedAt": "2026-07-09T00:20:00.000Z"
}
